{
  "auto_quantize_score_size": 128,
  "dataset_batch_size": 8,
  "dataset_calib_seq_len": 512,
  "dataset_max_calib_samples": 128,
  "dataset_num_calib_batches": 16,
  "dataset_num_calib_samples": 128,
  "dataset_size": "medium",
  "has_autoquant_state": true,
  "has_layer_sensitivity": true,
  "has_nonzero_sensitivity": true,
  "manifest_keys": [
    "autoquant_state",
    "dataset",
    "layer_sensitivity",
    "layers",
    "model",
    "num_quantized_layers",
    "quantization",
    "run_config",
    "scheme",
    "sensitivity_ranking"
  ],
  "mode": "lm_only",
  "quant_formats": [
    "INT4_BLOCKWISE_WEIGHT_ONLY_CFG"
  ],
  "quant_pair": "wint4_afp16",
  "scenario_id": "lm_only/wint4_afp16",
  "scheme_name": "wint4_afp16_autoquant_lm"
}
